{
  "assay_commit": "synthetic-starter-output",
  "call_observed": false,
  "called_tool_description_digest": null,
  "called_tool_manifest_digest": null,
  "called_tool_name": null,
  "claim_outcome": "diagnostic_only",
  "co_visible_tool_names": [
    "read_file"
  ],
  "context_descriptor_set_digest": "sha256:02f88a7f166da5e1a9109d9f8cc4e5bc61fffbe272d2452340f1aa46856488a6",
  "context_descriptor_set_ref": "context-descriptor-set.json",
  "created_at": "2026-05-29T00:00:00Z",
  "description_matches_manifest": null,
  "effect_capture_status": "unobserved",
  "effect_within_declared_boundary": null,
  "join_grade": "diagnostic",
  "join_key": "none",
  "mapping_notes": [
    "A tool definition is visible, but no call to that tool is observed inside the bounded call surface."
  ],
  "measured_effect_kind": "none",
  "measured_effect_ref": null,
  "model_visible_tool_description_refs": [
    {
      "declared_boundary": [
        "filesystem_read:/workspace/allowed/*"
      ],
      "digest": "sha256:933d4192f09bc1cb704f00d711c0462c1761fe82504024a424dcffcdd9ef9556",
      "ref": "context-descriptor-set.json#/tools/0",
      "source_surface": "synthetic_mcp_tools_list",
      "tool_name": "read_file"
    }
  ],
  "non_claims": [
    "does_not_detect_tool_poisoning",
    "does_not_classify_malicious_intent",
    "does_not_rank_mcp_clients_servers_or_providers",
    "does_not_define_mcp_spec_changes",
    "does_not_promote_experiment_schema_to_product_api",
    "does_not_claim_no_runtime_activity_occurred"
  ],
  "required_links_complete": true,
  "role": "absence_boundary",
  "scenario_id": "description_visible_no_call",
  "schema": "assay.experiment.mcp_tool_evidence_binding.binding_cell.v0",
  "tool_call_id": null,
  "tool_call_ref": null,
  "transport_context": null,
  "transport_profile": "local_synthetic"
}
